{"generated_at":"2026-07-22T21:22:04Z","totals":{"avoided_exposure_pugh":523280961218.0,"avoided_deaths":3266.5,"ci_low":-4121.9,"ci_high":7465.9},"wards":[{"ward_id":"delhi_273","avoided_exposure_pugh":248508683.3,"avoided_deaths":1.535,"ci_low":-1.947,"ci_high":3.493,"effect_ugm3":-18.7,"effect_ci_low":-55.5,"effect_ci_high":17.7},{"ward_id":"delhi_274","avoided_exposure_pugh":1579943447.3,"avoided_deaths":9.762,"ci_low":-12.38,"ci_high":22.206,"effect_ugm3":-18.7,"effect_ci_low":-55.5,"effect_ci_high":17.7},{"ward_id":"delhi_276","avoided_exposure_pugh":1368099928.8,"avoided_deaths":8.453,"ci_low":-10.72,"ci_high":19.228,"effect_ugm3":-18.7,"effect_ci_low":-55.5,"effect_ci_high":17.7},{"ward_id":"delhi_277","avoided_exposure_pugh":562550155.2,"avoided_deaths":3.476,"ci_low":-4.408,"ci_high":7.906,"effect_ugm3":-18.7,"effect_ci_low":-55.5,"effect_ci_high":17.7},{"ward_id":"delhi_278","avoided_exposure_pugh":2068173663.8,"avoided_deaths":17.464,"ci_low":-20.533,"ci_high":41.623,"effect_ugm3":-14.9,"effect_ci_low":-44.1,"effect_ci_high":14.1},{"ward_id":"delhi_279","avoided_exposure_pugh":810876132.0,"avoided_deaths":5.01,"ci_low":-6.354,"ci_high":11.397,"effect_ugm3":-18.7,"effect_ci_low":-55.5,"effect_ci_high":17.7},{"ward_id":"delhi_280","avoided_exposure_pugh":133635358.1,"avoided_deaths":2.148,"ci_low":-2.217,"ci_high":5.969,"effect_ugm3":-5.6,"effect_ci_low":-16.7,"effect_ci_high":5.3},{"ward_id":"delhi_275","avoided_exposure_pugh":864025137.4,"avoided_deaths":5.338,"ci_low":-6.77,"ci_high":12.144,"effect_ugm3":-18.7,"effect_ci_low":-55.5,"effect_ci_high":17.7},{"ward_id":"delhi_281","avoided_exposure_pugh":184365527.0,"avoided_deaths":1.459,"ci_low":-1.737,"ci_high":3.438,"effect_ugm3":-15.7,"effect_ci_low":-46.5,"effect_ci_high":14.8},{"ward_id":"delhi_282","avoided_exposure_pugh":518359960.8,"avoided_deaths":3.203,"ci_low":-4.062,"ci_high":7.285,"effect_ugm3":-18.7,"effect_ci_low":-55.5,"effect_ci_high":17.7},{"ward_id":"delhi_283","avoided_exposure_pugh":1474952583.6,"avoided_deaths":11.865,"ci_low":-14.051,"ci_high":28.033,"effect_ugm3":-15.5,"effect_ci_low":-45.9,"effect_ci_high":14.6},{"ward_id":"delhi_284","avoided_exposure_pugh":564039677.5,"avoided_deaths":3.485,"ci_low":-4.42,"ci_high":7.927,"effect_ugm3":-18.7,"effect_ci_low":-55.5,"effect_ci_high":17.7},{"ward_id":"delhi_285","avoided_exposure_pugh":474747213.6,"avoided_deaths":3.711,"ci_low":-4.462,"ci_high":8.756,"effect_ugm3":-15.8,"effect_ci_low":-47.0,"effect_ci_high":15.0},{"ward_id":"delhi_287","avoided_exposure_pugh":946500081.1,"avoided_deaths":5.848,"ci_low":-7.417,"ci_high":13.303,"effect_ugm3":-18.7,"effect_ci_low":-55.5,"effect_ci_high":17.7},{"ward_id":"delhi_288","avoided_exposure_pugh":324579610.1,"avoided_deaths":2.005,"ci_low":-2.543,"ci_high":4.562,"effect_ugm3":-18.7,"effect_ci_low":-55.5,"effect_ci_high":17.7},{"ward_id":"delhi_289","avoided_exposure_pugh":1215806054.4,"avoided_deaths":9.411,"ci_low":-11.281,"ci_high":22.052,"effect_ugm3":-16.0,"effect_ci_low":-47.3,"effect_ci_high":15.1},{"ward_id":"delhi_286","avoided_exposure_pugh":252096092.6,"avoided_deaths":2.061,"ci_low":-2.447,"ci_high":4.882,"effect_ugm3":-15.3,"effect_ci_low":-45.3,"effect_ci_high":14.5},{"ward_id":"delhi_252","avoided_exposure_pugh":1554831383.0,"avoided_deaths":9.85,"ci_low":-12.409,"ci_high":22.471,"effect_ugm3":-18.4,"effect_ci_low":-54.6,"effect_ci_high":17.4},{"ward_id":"delhi_253","avoided_exposure_pugh":810890787.6,"avoided_deaths":5.271,"ci_low":-6.595,"ci_high":12.062,"effect_ugm3":-18.1,"effect_ci_low":-53.7,"effect_ci_high":17.1},{"ward_id":"delhi_254","avoided_exposure_pugh":255727137.6,"avoided_deaths":1.58,"ci_low":-2.004,"ci_high":3.594,"effect_ugm3":-18.7,"effect_ci_low":-55.5,"effect_ci_high":17.7},{"ward_id":"delhi_255","avoided_exposure_pugh":415245378.2,"avoided_deaths":2.566,"ci_low":-3.254,"ci_high":5.836,"effect_ugm3":-18.7,"effect_ci_low":-55.5,"effect_ci_high":17.7},{"ward_id":"delhi_257","avoided_exposure_pugh":421253015.0,"avoided_deaths":2.603,"ci_low":-3.301,"ci_high":5.921,"effect_ugm3":-18.7,"effect_ci_low":-55.5,"effect_ci_high":17.7},{"ward_id":"delhi_011","avoided_exposure_pugh":1487936799.4,"avoided_deaths":9.193,"ci_low":-11.659,"ci_high":20.913,"effect_ugm3":-18.7,"effect_ci_low":-55.5,"effect_ci_high":17.7},{"ward_id":"delhi_012","avoided_exposure_pugh":2780064896.4,"avoided_deaths":17.177,"ci_low":-21.784,"ci_high":39.073,"effect_ugm3":-18.7,"effect_ci_low":-55.5,"effect_ci_high":17.7},{"ward_id":"delhi_013","avoided_exposure_pugh":1948038166.8,"avoided_deaths":12.036,"ci_low":-15.265,"ci_high":27.379,"effect_ugm3":-18.7,"effect_ci_low":-55.5,"effect_ci_high":17.7},{"ward_id":"delhi_021","avoided_exposure_pugh":1993838655.6,"avoided_deaths":12.319,"ci_low":-15.624,"ci_high":28.023,"effect_ugm3":-18.7,"effect_ci_low":-55.5,"effect_ci_high":17.7},{"ward_id":"delhi_022","avoided_exposure_pugh":1643494335.1,"avoided_deaths":10.155,"ci_low":-12.878,"ci_high":23.099,"effect_ugm3":-18.7,"effect_ci_low":-55.5,"effect_ci_high":17.7},{"ward_id":"delhi_023","avoided_exposure_pugh":1232222048.6,"avoided_deaths":7.613,"ci_low":-9.656,"ci_high":17.319,"effect_ugm3":-18.7,"effect_ci_low":-55.5,"effect_ci_high":17.7},{"ward_id":"delhi_025","avoided_exposure_pugh":484429199.8,"avoided_deaths":2.993,"ci_low":-3.796,"ci_high":6.809,"effect_ugm3":-18.7,"effect_ci_low":-55.5,"effect_ci_high":17.7},{"ward_id":"delhi_039","avoided_exposure_pugh":5663489016.2,"avoided_deaths":34.992,"ci_low":-44.378,"ci_high":79.599,"effect_ugm3":-18.7,"effect_ci_low":-55.5,"effect_ci_high":17.7},{"ward_id":"delhi_040","avoided_exposure_pugh":4121978960.9,"avoided_deaths":25.468,"ci_low":-32.299,"ci_high":57.933,"effect_ugm3":-18.7,"effect_ci_low":-55.5,"effect_ci_high":17.7},{"ward_id":"delhi_041","avoided_exposure_pugh":3247192357.2,"avoided_deaths":24.085,"ci_low":-29.228,"ci_high":56.146,"effect_ugm3":-16.5,"effect_ci_low":-48.9,"effect_ci_high":15.6},{"ward_id":"delhi_047","avoided_exposure_pugh":5450117440.3,"avoided_deaths":46.232,"ci_low":-54.237,"ci_high":110.684,"effect_ugm3":-14.8,"effect_ci_low":-44.0,"effect_ci_high":14.0},{"ward_id":"delhi_159","avoided_exposure_pugh":2443939869.6,"avoided_deaths":17.391,"ci_low":-21.358,"ci_high":40.29,"effect_ugm3":-17.0,"effect_ci_low":-50.4,"effect_ci_high":16.1},{"ward_id":"delhi_160","avoided_exposure_pugh":1247541522.5,"avoided_deaths":7.708,"ci_low":-9.776,"ci_high":17.534,"effect_ugm3":-18.7,"effect_ci_low":-55.5,"effect_ci_high":17.7},{"ward_id":"delhi_161","avoided_exposure_pugh":906772260.2,"avoided_deaths":5.603,"ci_low":-7.105,"ci_high":12.744,"effect_ugm3":-18.7,"effect_ci_low":-55.5,"effect_ci_high":17.7},{"ward_id":"delhi_162","avoided_exposure_pugh":1272767403.6,"avoided_deaths":7.864,"ci_low":-9.973,"ci_high":17.888,"effect_ugm3":-18.7,"effect_ci_low":-55.5,"effect_ci_high":17.7},{"ward_id":"delhi_163","avoided_exposure_pugh":1498143588.5,"avoided_deaths":9.256,"ci_low":-11.739,"ci_high":21.056,"effect_ugm3":-18.7,"effect_ci_low":-55.5,"effect_ci_high":17.7},{"ward_id":"delhi_164","avoided_exposure_pugh":1639041251.8,"avoided_deaths":10.127,"ci_low":-12.843,"ci_high":23.036,"effect_ugm3":-18.7,"effect_ci_low":-55.5,"effect_ci_high":17.7},{"ward_id":"delhi_165","avoided_exposure_pugh":2234209158.7,"avoided_deaths":13.804,"ci_low":-17.507,"ci_high":31.401,"effect_ugm3":-18.7,"effect_ci_low":-55.5,"effect_ci_high":17.7},{"ward_id":"delhi_166","avoided_exposure_pugh":1705664085.8,"avoided_deaths":10.539,"ci_low":-13.365,"ci_high":23.973,"effect_ugm3":-18.7,"effect_ci_low":-55.5,"effect_ci_high":17.7},{"ward_id":"delhi_167","avoided_exposure_pugh":852790237.2,"avoided_deaths":5.269,"ci_low":-6.682,"ci_high":11.986,"effect_ugm3":-18.7,"effect_ci_low":-55.5,"effect_ci_high":17.7},{"ward_id":"delhi_169","avoided_exposure_pugh":693615732.5,"avoided_deaths":4.286,"ci_low":-5.435,"ci_high":9.749,"effect_ugm3":-18.7,"effect_ci_low":-55.5,"effect_ci_high":17.7},{"ward_id":"delhi_171","avoided_exposure_pugh":879378675.1,"avoided_deaths":5.433,"ci_low":-6.891,"ci_high":12.359,"effect_ugm3":-18.7,"effect_ci_low":-55.5,"effect_ci_high":17.7},{"ward_id":"delhi_174","avoided_exposure_pugh":1026345909.6,"avoided_deaths":6.341,"ci_low":-8.042,"ci_high":14.425,"effect_ugm3":-18.7,"effect_ci_low":-55.5,"effect_ci_high":17.7},{"ward_id":"delhi_175","avoided_exposure_pugh":2907847950.5,"avoided_deaths":17.966,"ci_low":-22.786,"ci_high":40.869,"effect_ugm3":-18.7,"effect_ci_low":-55.5,"effect_ci_high":17.7},{"ward_id":"delhi_176","avoided_exposure_pugh":1015931640.2,"avoided_deaths":6.277,"ci_low":-7.961,"ci_high":14.279,"effect_ugm3":-18.7,"effect_ci_low":-55.5,"effect_ci_high":17.7},{"ward_id":"delhi_177","avoided_exposure_pugh":2408371788.2,"avoided_deaths":14.88,"ci_low":-18.872,"ci_high":33.849,"effect_ugm3":-18.7,"effect_ci_low":-55.5,"effect_ci_high":17.7},{"ward_id":"delhi_178","avoided_exposure_pugh":817382340.7,"avoided_deaths":5.05,"ci_low":-6.405,"ci_high":11.488,"effect_ugm3":-18.7,"effect_ci_low":-55.5,"effect_ci_high":17.7},{"ward_id":"delhi_180","avoided_exposure_pugh":701280114.5,"avoided_deaths":4.333,"ci_low":-5.495,"ci_high":9.856,"effect_ugm3":-18.7,"effect_ci_low":-55.5,"effect_ci_high":17.7},{"ward_id":"delhi_181","avoided_exposure_pugh":3324712913.3,"avoided_deaths":20.542,"ci_low":-26.052,"ci_high":46.728,"effect_ugm3":-18.7,"effect_ci_low":-55.5,"effect_ci_high":17.7},{"ward_id":"delhi_182","avoided_exposure_pugh":2701148083.9,"avoided_deaths":16.689,"ci_low":-21.166,"ci_high":37.964,"effect_ugm3":-18.7,"effect_ci_low":-55.5,"effect_ci_high":17.7},{"ward_id":"delhi_183","avoided_exposure_pugh":2575876469.8,"avoided_deaths":15.915,"ci_low":-20.184,"ci_high":36.203,"effect_ugm3":-18.7,"effect_ci_low":-55.5,"effect_ci_high":17.7},{"ward_id":"delhi_184","avoided_exposure_pugh":2379061333.4,"avoided_deaths":14.699,"ci_low":-18.642,"ci_high":33.437,"effect_ugm3":-18.7,"effect_ci_low":-55.5,"effect_ci_high":17.7},{"ward_id":"delhi_185","avoided_exposure_pugh":3535881346.8,"avoided_deat